{
  "$schema": "https://json-schema.org/draft/2020-12/schema",
  "$id": "https://aletheia.local/schemas/skill-execution-patterns.schema.json",
  "title": "Skill Execution Patterns (per-skill compatibility declaration)",
  "description": "Optional structured record for the per-skill execution pattern compatibility declaration shipped by the Adaptative Skills repo (templates/skill-execution-patterns.yaml there; docs/contracts/execution-pattern-selection.md here). A skill declares which execution patterns it can and cannot run in, with conditions, required controls, evidence by pattern, escalation triggers, and audit duties. The schema does not select or enforce; it makes the declaration explicit and enforces structurally that incompatibility carries a rationale, that compatible patterns name at least one control, and that any loop compatibility keeps the objective_gate_missing escalation trigger.",
  "type": "object",
  "additionalProperties": false,
  "required": [
    "skill_id",
    "version",
    "compatible_patterns",
    "incompatible_patterns",
    "escalation_triggers",
    "audit_requirements"
  ],
  "$defs": {
    "pattern": {
      "type": "string",
      "enum": [
        "manual_prompt",
        "single_agent",
        "classify_and_act",
        "fan_out_and_synthesize",
        "adversarial_verification",
        "generate_and_filter",
        "tournament_compare",
        "loop_until_done",
        "scheduled_stateful_loop",
        "human_led_workflow"
      ]
    }
  },
  "properties": {
    "skill_id": { "type": "string", "minLength": 1 },
    "version": { "type": "string", "minLength": 1 },
    "compatible_patterns": {
      "type": "array",
      "items": {
        "type": "object",
        "additionalProperties": false,
        "required": ["pattern", "conditions", "required_controls"],
        "properties": {
          "pattern": { "$ref": "#/$defs/pattern" },
          "conditions": { "type": "string", "minLength": 1 },
          "required_controls": {
            "type": "array",
            "minItems": 1,
            "items": { "type": "string", "minLength": 1 }
          }
        }
      }
    },
    "incompatible_patterns": {
      "type": "array",
      "items": {
        "type": "object",
        "additionalProperties": false,
        "required": ["pattern", "rationale"],
        "properties": {
          "pattern": { "$ref": "#/$defs/pattern" },
          "rationale": { "type": "string", "minLength": 1 }
        }
      }
    },
    "required_evidence_by_pattern": {
      "type": "object",
      "propertyNames": { "$ref": "#/$defs/pattern" },
      "additionalProperties": {
        "type": "object",
        "additionalProperties": false,
        "required": ["evidence"],
        "properties": {
          "evidence": {
            "type": "array",
            "minItems": 1,
            "items": { "type": "string", "minLength": 1 }
          }
        }
      }
    },
    "escalation_triggers": {
      "type": "array",
      "minItems": 1,
      "items": { "type": "string", "minLength": 1 }
    },
    "audit_requirements": {
      "type": "object",
      "additionalProperties": false,
      "required": ["log_skill_id", "log_pattern", "log_controls", "log_evidence_refs"],
      "properties": {
        "log_skill_id": { "type": "boolean" },
        "log_pattern": { "type": "boolean" },
        "log_controls": { "type": "boolean" },
        "log_evidence_refs": { "type": "boolean" }
      }
    }
  },
  "allOf": [
    {
      "$comment": "Invariant 1 — loop compatibility keeps its escape hatch: a skill declaring compatibility with loop_until_done or scheduled_stateful_loop must keep objective_gate_missing among its escalation triggers, so a run with no objective gate routes back instead of looping anyway.",
      "if": {
        "properties": {
          "compatible_patterns": {
            "contains": {
              "properties": { "pattern": { "enum": ["loop_until_done", "scheduled_stateful_loop"] } },
              "required": ["pattern"]
            }
          }
        },
        "required": ["compatible_patterns"]
      },
      "then": {
        "properties": {
          "escalation_triggers": {
            "contains": { "const": "objective_gate_missing" }
          }
        },
        "required": ["escalation_triggers"]
      }
    }
  ]
}
